{
  "title": "Path Traversal via Unsanitized Attachment Filename in DownloadAttachmentWorker",
  "cwe_id": "CWE-22",
  "cwe_name": "Improper Limitation of a Pathname to a Restricted Directory ('Path Traversal')",
  "historic_cve": "CVE-2025-20949",
  "cvss_historic": {
    "base_score": 9.1,
    "severity": "CRITICAL",
    "vector": "CVSS:3.1/AV:N/AC:L/PR:N/UI:N/S:U/C:H/I:H/A:N"
  },
  "cvss_synthetic": {
    "base_score": 7.5,
    "severity": "HIGH",
    "vector": "CVSS:3.1/AV:N/AC:L/PR:N/UI:N/S:U/C:N/I:H/A:N"
  }
}
