{
  "title": "Exported MainActivity Opens Internal Chat with Active User Privileges",
  "cwe_id": "CWE-926",
  "cwe_name": "Improper Export of Android Application Components",
  "historic_cve": "CVE-2025-20923",
  "cvss_historic": {
    "base_score": 4.0,
    "severity": "MEDIUM",
    "vector": "CVSS:3.1/AV:L/AC:H/PR:N/UI:N/S:U/C:N/I:L/A:L"
  },
  "cvss_synthetic": {
    "base_score": 4.0,
    "severity": "MEDIUM",
    "vector": "CVSS:3.1/AV:L/AC:H/PR:N/UI:N/S:U/C:N/I:L/A:L"
  }
}
