{
  "title": "Insecure Communication via Disabled SSL Certificate Validation",
  "cwe_id": "CWE-295",
  "cwe_name": "Improper Certificate Validation",
  "historic_cve": "CVE-2025-50944",
  "cvss_historic": {
    "base_score": 8.8,
    "severity": "HIGH",
    "vector": "CVSS:3.1/AV:N/AC:L/PR:N/UI:R/S:U/C:H/I:H/A:H"
  },
  "cvss_synthetic": {
    "base_score": 7.4,
    "severity": "HIGH",
    "vector": "CVSS:3.1/AV:N/AC:H/PR:N/UI:N/S:U/C:H/I:H/A:N"
  }
}
