{
  "title": "Deep Link Hidden Command Injection via Custom URL Scheme",
  "cwe_id": "CWE-939",
  "cwe_name": "Improper Authorization in Handler for Custom URL Scheme",
  "historic_cve": "CVE-2025-41408",
  "cvss_historic": {
    "base_score": 4.3,
    "severity": "MEDIUM",
    "vector": "CVSS:3.0/AV:N/AC:L/PR:N/UI:R/S:U/C:N/I:L/A:N"
  },
  "cvss_synthetic": {
    "base_score": 5.5,
    "severity": "MEDIUM",
    "vector": "CVSS:3.1/AV:L/AC:L/PR:N/UI:R/S:U/C:N/I:H/A:N"
  }
}
