{
  "title": "Hardcoded Admin Credentials in App Package",
  "attacker_model": "remote_attacker",
  "cwe_id": "CWE-798",
  "cwe_name": "Use of Hard-coded Credentials",
  "historic_cve": "CVE-2025-41110",
  "cvss_historic": {
    "base_score": 8.8,
    "severity": "HIGH",
    "vector": "CVSS:3.1/AV:A/AC:L/PR:N/UI:N/S:U/C:H/I:H/A:H"
  },
  "cvss_synthetic": {
    "base_score": 8.8,
    "severity": "HIGH",
    "vector": "CVSS:3.1/AV:A/AC:L/PR:N/UI:N/S:U/C:H/I:H/A:H"
  }
}
